keywords,year,_description,_title,_artists,_material,_dimensions,_inventory_number,_realyear,id
"Porträtt,holländsk,man",1640,"Målningen hämtar inspiration från en samtida holländsk teaterpjäs, som i sin tur är baserad på en pikareskroman av Cervantes. I centrum står en aristokrats kärlek till en vacker ung kvinna som redan som barn rövats bort av romer. Vi ser hur den djupt förälskade ynglingen närmar sig den unga kvinnan som håller ett knippe rosor, en symbol för kärleken. Han får genomgå en rad prövningar innan han vinner sin kärestas hand. Det visar sig då att hon är av samma höga börd som han själv.",Blomsterförsäljaren,"Paulus Bor","Olja på ek","Mått 143 x 174,5 cm","NM 5041",1640,22091
"Scen,flamländsk,man",1500,,"Hos uppbördsmannen","Jan Massys","Olja på duk överförd från trä","Mått 70 x 106 cm","NM 505",1514,17508
"Religion/Mytologi,flamländsk,man",1560,"Kvinnan i målningen har tolkats som både Venus och Flora. Nejlikorna i buketten ansågs ha en kärleksstimulerande effekt. Blommorna kan också symbolisera doftsinnet. Påfågeln står för prål och lyx, men är också en moralisk pekpinne mot all lust- och skönhetsdyrkan. Den eleganta och sensuella stilen överensstämmer med den franska och nordeuropeiska hovkulturens smak. I bakgrunden skymtar hamnstaden Genua.","Venus Cythereia","Jan Massys","Olja på ek","Mått 130 x 156 cm","NM 507",1561,17510
"Religion/Mytologi,flamländsk,man",1560,,"Det omaka paret","Jan Massys","Olja på trä","Mått 97 x 134 cm","NM 508",1566,17511
",italiensk,man",1740,,"Gården i ett renässanspalats","Michele Marieschi","Olja på duk","Mått 35,5 x 56 cm","NM 51",1740,19045
"Scen,holländsk,man",1640,"En fashionabel ung kvinna spelar kort med en officer i en elegant interiör, medan en annan man räcker henne en pipa. Scener med kortspelare och rökare i värdshus och bordeller där soldater umgås med kurtisaner hade en lång tradition i nederländsk konst. Den amorösa kontexten antyds genom kvinnans fotvärmare, ett bruksföremål men också symbol för den kärlekskranke som söker tillfredsställa en kvinna genom att underkasta sig hennes vilja.",Spelparti,"Gabriel Metsu","Olja på ek","Mått 65 x 58 cm","NM 510",1658,17513
"Religion/Mytologi,fransk,man",1640,"Artemisia var änka efter kung Mausollos (död 352 f. Kr) och efterträdde honom som härskare i Karien, i dagens sydvästra Turkiet. Den enorma grav som hon lät uppföra för sin man och sig själv blev känd som ett av världens sju underverk: mausoleet i Halikarnassos. Simon Vouet avbildar Artemisia tillsammans med de två grekiska arkitekter som gjorde ritningarna till mausoleet. Drottningen pekar på den del av planen som just håller på att byggas.","Artemisia låter bygga Mausoleum","Simon Vouet","Olja på duk","Mått 161 x 139 cm","NM 5179",1640,22229
"Landskap,dansk,man",1820,,"Båt uppdragen på stranden","Christen Købke","Olja på papper uppklistrat på duk","Mått 26 x 36 cm","NM 5194",1839,22244
"Landskap,dansk,man",1820,,"Dosseringen sedd från vattnet","Christen Købke","Olja på papper uppklistrad på duk","Mått 21,5 x 30 cm","NM 5195",1837,22245
"Stilleben,holländsk,man",1700,,Fruktfeston,"Jan Davidsz. de Heem","Olja på duk","Mått 59 x 75 cm","NM 520",1700,17523
"Porträtt, Landskap,svensk,man",1880,,"Konstnärens hustru vid stranden i Noirmoutier","Gustaf Cederström","Olja på trä","Mått 27 x 35 cm","NM 5202",1882,22252
"Porträtt,svensk,man",1880,,"Carola i soffan","Gustaf Cederström","Olja på duk","Mått 60 x 73 cm","NM 5204",1899,22254
",svensk,man",1860,,"Karl XII:s likfärd. Skiss till GKM 1100 och NM 1363","Gustaf Cederström","Olja på trä","Mått 31 x 44 cm","NM 5205",1877,22255
",svensk,man",1880,,"30 november. Skiss","Gustaf Cederström","Olja på trä","Mått 32 x 24 cm","NM 5209",1896,22259
"Landskap,svensk,man",1860,,"Stäppmark. Landskapsstudie till Mazeppa","Gustaf Cederström","Olja på duk","Mått 46 x 61 cm","NM 5212",1879,22262
"Stadsbild,tysk,man",1860,,"Partenkirchen i Bayern vid soluppgång","Karl Millner","Olja på duk","Mått 72 x 88 cm","NM 5222",1860,22272
"Stilleben,tysk,man",1640,,"Stilleben med ölglas och nötter","Georg Hainz","Olja på duk monterad på masonit","Mått 27 x 30 cm","NM 5225",1645,22275
"Landskap,svensk,man",1680,"Den 27 juli 1696 lyckades stalldrängen Anders Ek fånga en albinoekorre. Den fördes direkt till den naturintresserade Karl XI och sattes i bur. I målningen avbildas ekorren dock fri i ett landskap, där den sitter under ett träd och gnager på en nöt. I ett brev från kungen den 12 februari 1697 får Ehrenstrahl uppdraget att måla det sällsynta djuret. Karl XI hann troligen inte se ekorrporträttet, eftersom han avled knappt två månader senare.","Vit ekorre i landskap","David Klöcker Ehrenstrahl","Olja på duk","Mått 61,5 x 64 cm","NM 5234",1697,22284
"Landskap,svensk,man",1880,,Höst,"Garibaldi Lindberg","Olja på duk","Mått 100 x 160 cm","NM 5236",1897,22286
"Stadsbild,flamländsk,man",1740,"Se även beskrivning i den engelska versionen","Utsikt över Rom","Hendrik Frans van Lint","Olja på duk","Mått 23 x 35 cm","NM 5245",1741,22295
"Landskap,svensk,man",1880,"Georg Pauli vistades i Grez under 1884. Den här studien är sannolikt tillkommen på våren. Liksom flera andra svenskar i Grez har Pauli hämtat sitt motiv i någon av trädgårdarna vid byns pensioner. På sommaren reste Pauli till kusten och byn Ver-sur-Mer i sällskap med bland andra Robert Thegerström.","Trädgård i Grez","Georg Pauli","Olja på duk","Mått 36,5 x 45 cm","NM 5264",1884,22314
"Stilleben,italiensk,man",1640,"Målningarna är exempel på motivet sottobosco, skildringar av amfibier och insekter på nära håll. Djuren avbildas med vetenskaplig noggrannhet och till synes i sin naturliga miljö, men studerades vanligtvis var för sig för att sedan sättas samman till en estetiskt tilltalande komposition. Ämnet är i grunden en allegori över kampen mellan gott och ont.","Stilleben med grodor, törnrosor, snäckor och fjärilar","Paolo Porpora","Olja på duk","Mått 35 x 48 cm","NM 5271",1650,22321
"Stilleben,italiensk,man",1640,,"Stilleben med ormar, flugsvampar och tistlar","Paolo Porpora","Olja på duk","Mått 35 x 48 cm","NM 5272",1650,22322
"Självporträtt,holländsk,man",1620,"Rembrandt var 24 år när han utförde detta självporträtt. Det är målat på kopparplåt, det material han utförde sina etsningar på. Ovanligt nog har konstnären använt sig av en grundering i blyvitt täckt med bladguld, troligen för att ge större lyster åt färgerna. Självporträttet är målat med små fina penseldrag, vilket är typiskt för Rembrandts tidiga verk då han ännu var starkt influerad av de så kallade finmålarna i hemstaden Leiden.",Självporträtt,"Rembrandt Harmensz. van Rijn","Olja på koppar","Mått 15,5 x 12 cm","NM 5324",1630,22374
",nederländsk",1500,,"Konungarnas tillbedjan",Okänd,"Olja på koppar","Mått 31 x 26 cm","NM 533",1500,17536
"Djur,tysk,man",1760,,"Örn som fångar en hare","Johann Friedrich von Grooth","Olja på duk","Mått 111 x 83,5 cm","NM 5335",1779,22385
"Barn,fransk,man",1780,"En fattig familjefar har precis varit hos en kirurg som behöver övning och låtit sig tappas på blod. Med pengarna han fått har han köpt bröd som han med bandagerad arm lägger upp på bordet åt sin familj. De är både förfärade och tacksamma för hans drastiska, men heroiska uppoffring. Miljön är samtida men berättelser om uppoffrande handlingar går tillbaka till antiken. Skildringar av såväl samtida som historiska moraliska förebilder var populära under det sena 1700-talet.","Den självuppoffrande fadern","Jacques Sablet","Olja på duk","Mått 99 x 136 cm","NM 5343",1784,22393
"Landskap,flamländsk,man",1680,"Se även beskrivning i den engelska versionen",Skeppsbrott,"Peter van den Velde","Olja på duk monterad på masonit","Mått 57 x 82,5 cm","NM 5351",1692,22401
",flamländsk,man",1600,"Se även beskrivning i den engelska versionen","Interiör av gotisk kyrka","Peeter Neeffs d.ä.","Olja på koppar","Mått 26,1 x 37,6 x 0,1 cm","NM 536",1604,17539
"Religion/Mytologi,svensk,man",1800,,"Bröllopet i Kanaan. Allmogemålning","Anders Eriksson","Gouache och olja på duk","Mått 83 x 83 cm","NM 5372",1807,22422
"Scen,holländsk,man",1660,,"Gosse och flicka skjuter fåglar med blåsrör","Eglon Hendrik van der Neer","Olja på trä","Mått 26 x 20 cm","NM 538",1664,17541
"Religion/Mytologi,spansk,man",1620,"Målningen visar det som inom kristen tradition har kallats ”det sanna Kristusporträttet”, ett avtryck av Jesus ansikte på en linneduk. Det sägs ha uppkommit mirakulöst genom att en kvinna som hette Veronika torkade svett och blod från Jesus panna på hans väg till Golgata. Zurbarán avbildar svetteduken i dramatiskt sidoljus som kontrasterar den svarta bakgrunden. Dukens veck bildar en ram runt ett relativt mänskligt porträtt av Jesus med törnekrona.","Veronikas svetteduk","Francisco de Zurbaran","Olja på duk","Mått 70 x 51,5 cm","NM 5382",1633,22432
"Barn,holländsk,man",1660,,Familjegrupp,"Pieter Codde","Olja på ek","Mått 42 x 48 cm","NM 539",1661,17542
"Religion/Mytologi,italiensk,man,italiensk,man,italiensk,okänd",1500,"Se beskrivning i den engelska versionen","Kvinnorna vid Kristi grav","Annibale Carracci (Kopia efter), Giovanni Lanfranco (Konstnär), Okänd (Tidigare attribution)","Olja på duk","Mått 105 x 144 cm","NM 54",1500,19048
",holländsk,man",1680,,"Interiör av St Bavo i Haarlem","Isaak van Nickelen","Olja på duk monterad på ek","Mått 37,3 x 43,9 cm","NM 541",1695,17544
"Religion/Mytologi,fransk,man",1620,,"Den helige Hieronymus uppenbarelse","Claude Vignon","Olja på duk","Mått 164,5 x 125,5 cm","NM 5427",1626,22477
"Barn, Scen,svensk,man",1880,,"Gustav Vasa inför kung Hans","J.A.G. Acke (eg. Johan Axel Gustaf Andersson)","Olja på duk","Mått 110 x 149 cm","NM 5428",1881,22478
",svensk,man",1880,,"Dans med osämja","Axel Sjöberg","Olja på duk","Mått 115 x 100 cm","NM 5436",1896,22486
"Landskap,svensk,man",1860,,"Flodlandskap, Champagne","Carl Fredrik Hill","Olja på duk","Mått 105 x 125 cm","NM 5464",1876,22514
"Porträtt,holländsk,man",1640,,"Gumma hållande ett krus","Adriaen van Ostade","Olja på ek","Mått 16 x 14 x 0,6 cm","NM 548",1644,17551
"Porträtt,holländsk,man",1640,,"Bonde läsande en tidning","Adriaen van Ostade","Olja på ek","Mått 16,5 x 13,7 x 1 cm","NM 549",1648,17552
",svensk,man",1740,,"Antik scen","Johan Fredrik Hörling","Olja på duk","Mått 63 x 78 cm","NM 5490",1746,22540
"Landskap,italiensk",1600,,"Landskap med Kristus och de två lärjungarna på väg till Emaus",Okänd,"Olja på duk","Mått 64 x 49 cm","NM 55",1600,19049
"Barn,holländsk,man",1660,"Van Ostades supande bönder förvandlades med tiden till sympatiskt bondfolk i pittoreska miljöer, här en familj samlade framför spiseln i ett stökigt värdshus. Under överinseende av den distraherade modern kivas barnen om en kanna mjölk. Den utspillda mjölken och omkullvälta klädkorgen antyder att detta är en upp-och-nedvänd värld där barnens olydnad blir konsekvensen av bristande föräldraskap.","Värdshusinteriör med bondfamilj","Adriaen van Ostade","Olja på ek","Mått 46 x 39 cm","NM 550",1668,17553
",flamländsk,man",1700,"Se även beskrivning i den engelska versionen","Besök i en skulptörs atelje","Balthasar van den Bosch","Olja på duk","Mått 52 x 61 cm","NM 5501",1704,22551
"Porträtt,holländsk,man",1660,,"Advokat vid sitt skrivbord","Adriaen van Ostade","Olja på trä","Mått 23 x 19 cm","NM 551",1664,17554
"Scen,holländsk,man",1640,,"Drickande och rökande bönder","Adriaen van Ostade","Olja på trä","Mått 21 x 18 cm","NM 552",1643,17555
"Scen, Landskap,fransk,kvinna",1860,"Morisots friluftsmålningar med skissartad teknik och enastående färgverkan fick stor uppmärksamhet på impressionisternas utställningar. Hon var kritisk till tidens borgerliga normer för kvinnlighet och skildrade relationen mellan mödrar och döttrar. Borgerliga kvinnor var hänvisade till hemmets privata sfär och vissa offentliga rum som varuhus, teatrar, restauranger och parker. I de kvinnliga impressionisternas bilder betonas närhet och relationer.","I Boulognerskogen","Berthe Morisot","Olja på duk","Mått 61 x 73,5 cm","NM 5525",1870,22575
"Landskap,dansk,man",1820,,"Dosseringen mot Østerbro","Christen Købke","Olja på duk","Mått 25,5 x 39,5 cm","NM 5528",1836,22578
",finsk,man",1880,,"Interiör av Louvren","John (Juho) Forssell","Olja på duk","Mått 85 x 64 cm","NM 5559",1883,22609
"Självporträtt,holländsk,man",1640,,Självporträtt,"Isaack van Ostade","Olja på trä","Mått 26 x 23 cm","NM 557",1641,17560
",spansk,man",1800,"Poesin symboliseras av kvinnan med lyra. Hon sitter nära berget Helikons topp. Där bodde muserna, skaldekonstens gudinnor. Från bergstoppen tar Pegasus ett kraftigt språng. Det skapar källan till den poetiska inspirationens bäckar. Tre diktare, möjligen Homeros, Horatius och Ovidius, närmar sig källan. I denna allegori har Goya utgått från Cesare Ripas symbollexikon Iconologica, från 1593. Det blev standardverk för konstnärer i flera århundraden.","Poesin och skalderna","Francisco Goya Y Lucientes","Olja på duk","Mått 298 x 326 cm","NM 5592",1804,22642
",spansk,man",1800,"Motivet berättar hur Historien är vittne när Tiden avslöjar Sanningen. Oftast symboliseras de av – i tur och ordning – en skrivande kvinna, en äldre man med vingar och timglas samt en kvinna, oftast naken. Här är den stående kvinnan symbol för både Sanningen och Spanien. Hon håller en spira, en rikssymbol och en bok, den konstitution Spanien antog 1812, mitt under kriget mot Napoleon. Den dubbla symboliken understryker författningens berättigande.","Sanningen, Tiden och Historien","Francisco Goya Y Lucientes","Olja på duk","Mått 294 x 244 cm","NM 5593",1804,22643
"Scen,holländsk,man",1640,,"Hamnstycke med speglande vatten","Jan van de Cappelle","Olja på ek","Mått 55,1 x 70,6 cm","NM 562",1649,17565
",fransk,man",1700,"Teatermotiv är återkommande i Watteaus måleri. Här har han inspirerats av persongalleriet i så kallad commedia dell’arte. Teaterformen karaktäriseras bland annat av masker och pantomim och utgår från fastställda figurer. Watteau har dock tagit figurerna från teaterscenen och placerat dem i ett parklandskap, vilket var ovanligt. Pierrot spelar en serenad för en ung flicka, möjligen Colombine, medan bland andra Scaramouche och en gycklare ser på.","Den italienska serenaden","Antoine Watteau","Olja på trä","Mått 33,5 x 27 cm","NM 5650",1714,22701
"Stadsbild, Landskap,dansk,man",1880,,"Landskap med stad","Johan Rohde","Olja på duk","Mått 56 x 75 cm","NM 5653",1894,22704
",dansk,man",1840,,"Christian A. Bang","Christian Albrecht Jensen","Olja på duk","Mått 56 x 44 cm","NM 5678",1842,22729
",svensk,man",1860,,"Gustaf Vasa anklagar Peder Sunnanväder och Mäster Knut inför dom- *","Carl Gustaf Hellqvist","Olja på duk","Mått 118 x 164,5 cm","NM 5714",1876,22765
"Porträtt,svensk,man",1740,"Alexander Roslins framgång bland de förmögna beställarna i Paris berodde inte minst på hans skicklighet att fånga modellernas rika accessoarer, till exempel i detta porträtt, som förmodligen föreställer mme Deshanges. Roslin målade det samma år som han valdes in i den franska konstakademin. Det skedde endast arton månader efter hans ankomst till Paris.","Okänd kvinna, möjligen Madame Deshanges","Alexander Roslin","Olja på duk","Mått 65 x 54 cm","NM 5752",1753,22802
"Religion/Mytologi,holländsk,man",1640,"Detta fragment av en monumental historiemålning från Rembrandts sista period beställdes för det nya rådhuset i Amsterdam. Av okänd anledning togs den ned och beskars, sannolikt av Rembrandt själv, och ersattes med en målning av annan konstnär. Den holländska republiken ville manifestera sin frigörelse från Spanien. Detta förklarar valet av motiv. Bataverna var en germansk folkstam i ytterkanten av romarriket, som gjorde uppror mot romarna 69–70 e.Kr. I en dramatiskt ljussatt nattscen skildrar Rembrandt hur batavernas ledare, den enögde hövdingen Claudius Civilis, eggar sina soldater att svära honom trohet i kampen mot romersk överhöghet. Med det pastosa ljusdunkelmåleriets medel skapade Rembrandt en intensivt koncentrerad tolkning av det patriotiska ämnet. Målningens ägarhistoria är höljd i dunkel. Anna Johanna Peill ärvde den 1767 efter sin far Claes Grill. Hon skänkte den för ”evärdlig tid” till Konstakademien.","Batavernas trohetsed till Claudius Civilis","Rembrandt Harmensz. van Rijn","Olja på duk","Mått 196 x 309 cm","NM 578",1659,17581
"Landskap,svensk,man",1920,,Åskluft,"Oscar Hullgren","Olja på duk monterad på papp","Mått 43,5 x 54,5 cm","NM 5788",1933,22838
"Religion/Mytologi,holländsk,man",1620,"I ett rum med höga valv sitter en gammal man och läser. Genom det stora fönstret till höger och dörröppningen till vänster faller ett svagt dagsljus in i rummet. Det suggestiva ljusdunklet och detaljrika historiemåleriet med små figurer är typiskt för Rembrandts ungdomsverk.","En lärd gammal man i ett välvt rum (”Den helige Anastasius”)","Rembrandt Harmensz. van Rijn","Olja på trä","Mått 60 x 48 cm","NM 579",1631,17582
"Porträtt,holländsk,man",1640,,"Porträtt av en gammal man","Rembrandt Harmensz. van Rijn","Olja på duk","Mått 89 x 74 cm","NM 581",1655,17584
"Porträtt,holländsk,man",1640,,"Porträtt av en gammal dam","Rembrandt Harmensz. van Rijn","Olja på duk","Mått 87 x 73 cm","NM 582",1655,17585
"Stilleben,svensk,man",1860,,Fågelstilleben,"Theodor Lundh","Olja på duk","Mått 82 x 59,5 cm","NM 5829",1864,22879
"Porträtt,holländsk,man",1620,"Målningen av kvinnan i halvfigur är inte ett porträtt i egentlig mening. Den är en så kallad tronie – en målning av en fängslande individ, oftast som här iklädd exotisk dräkt. Den plisserade vita blusen speglar 1500-talets mode; manteln med guldbroderier tycks sprungen ur konstnärens fantasi. Målningarna var populära samlarobjekt som visade konstnärens uppfinningsrikedom och skicklighet.","Ung kvinna i profil, med solfjäder","Rembrandt Harmensz. van Rijn","Olja på duk","Mått 72 x 55 cm","NM 583",1632,17586
"Porträtt,holländsk,man",1640,"Omkring 1650 utförde Rembrandt flera målningar med kvinnor i halvfigur, som påminner om Kökspigan. Den levande framställningen av flickan i fönstret är utförd med breda penseldrag och kraftiga kontraster mellan ljus och skugga. Den varmt röda jackan kontrasterar harmoniskt mot den vita blusen och den mörka bakgrunden. Målningen ägdes av greve Johan Gabriel Stenbock, som reste till bland annat Holland på 1670-talet.","Flicka i ett fönster, ""Kökspigan""","Rembrandt Harmensz. van Rijn","Olja på duk","Mått 78 x 64 cm","NM 584",1651,17587
"Religion/Mytologi,italiensk,man",1760,,"Maria sörjande vid graven","Lorenzo Gramiccia","Olja på kartong","Mått 29 x 20,5 cm","NM 5857",1764,22907
"Porträtt,engelsk,man",1760,"Gainsborough var samtida med Reynolds. Båda specialiserade sig på porträtt av brittisk aristokratin. Anslaget var storslaget till innehåll och format och oftast avbildades modellerna i helfigur. Konstnären var dessutom en mycket driven landskapsmålare och den unga kvinnan ramas in av bakgrundens romantiskt lummiga engelska park. Även Joshua Reynolds porträtterade lady Eardley, som var gift med bankiren Sampson Gideon, adlad baron Eardley.","Maria, Lady Eardley","Thomas Gainsborough","Olja på duk","Mått 215 x 149 cm","NM 5893",1768,22943
"Religion/Mytologi,spansk",1660,,"Det heliga sakramentet",Okänd,"Olja på duk monterad på trä","Mått 111 x 84 cm","NM 5974",1660,23024
",svensk,man",1820,,"Flicka med ljus i handen mellan spelman och gumma","Pehr Berggren","Olja på duk","Mått 33 x 30 cm","NM 5977",1830,23027
"Religion/Mytologi,flamländsk,man",1620,"Scenen föreställer ett dryckeslag, eller backanal, på den grekiska ön Andros, där guden Bacchus hade skapat en aldrig sinande vinflod. Rubens version är en fri kopia efter ett verk av 1500-talsmålaren Tizian (Prado, Madrid). Rubens målning skiljer sig från Tizians genom ett mer temperamentsfullt uttryck och han betraktade den själv som ett original. Målningen är en av ett par. Den andra har titeln Offer till Venus och tillhör också Nationalmuseum.","Backanal på Andros","Peter Paul Rubens","Olja på duk","Mått 200 x 215 cm","NM 600",1630,17603
"Religion/Mytologi,flamländsk,man,nederländsk,man",1600,"De tre gracerna, ett slags glädjens gudinnor, var i den grekiska mytologin döttrar till Zeus och Eurynome. De var ett vanligt motiv i konsten och Rubens  – en av barockens mest kända målare –   återvände till det flera gånger. Här lyfter gracerna i en gemensam kraftansträngning en blomsterkorg. Konstnären koncentrerar sig dock inte på den mytologiska berättelsen utan på att framställa de kvinnliga kropparnas former och rörelser. Den nakna huden framstår som varm och levande inför betraktarens ögon.","De tre gracerna","Peter Paul Rubens (Konstnär), Jan Brueghel d.y. (Konstnär)","Olja på duk","Mått 111 x 64 cm","NM 601",1618,17604
"Religion/Mytologi,flamländsk,man",1600,"Ett av Rubens favoritmotiv var berättelsen om Susanna i Babylon och gubbarna som smyger sig på henne när hon badar. När hon fylld av skräck står emot deras närmanden anmäler de henne för äktenskapsbrott, men profeten Daniel bevisar hennes oskuld. Samtidigt som Susannas dygd lyfts fram som ett ideal, gav motivet konstnären en förevändning att visa den nakna kvinnans glänsande hud, modellerad med hjälp tunna, genomlysliga skikt av rosa och grå färg.","Susanna och gubbarna","Peter Paul Rubens","Olja på ek","Mått 66 x 51 cm","NM 603",1614,17606
"Landskap,svensk,man",1860,,"Stranden vid Luc, Frankrike","Carl Fredrik Hill","Olja på duk","Mått 46,5 x 61,5 cm","NM 6065",1876,23115
"Religion/Mytologi,flamländsk,man",1620,"Rubens var en bildad konstnär som ibland tog sig an ovanliga ämnen ur den antika mytologin. I den här oljeskissen är det en episod ur Ovidius Metamorfoser som skildras. Gudinnan Minerva har anförtrott tre systrar en korg med ett barn att ta hand om. Men de får inte öppna korgen. Rubens fokuserar på deras reaktioner när de ändå lyfter på locket och upptäcker att barnet har ormben. Kråkan (på fontänens kant) skvallrar och de straffas med galenskap.","Cecrops döttrar finner Erichtonius","Peter Paul Rubens","Olja på ek","Mått 31 x 33 cm","NM 607",1630,17610
"Religion/Mytologi,italiensk,man,italiensk",1600,"Se beskrivning i den engelska versionen.","Josefs dröm","Giovanni Battista Pace (Konstnär), Okänd (Tidigare attribution)","Olja på duk","Mått 61 x 74 cm","NM 61",1600,19055
"Religion/Mytologi,spansk,man",1620,"Hieronymus (ca 347-420) skildras som ålderstigen botgörare i begrundan av Kristi passion, här symboliserad av korset. Han lyssnar till trumpeten som tillkännager den yttersta domen. En ljusstråle ovanifrån framhäver skoningslöst hans åldrade hud och grånade skägg. Skickligt avbildas de perspektiviskt förkortade volymerna med slitna band intill kraniets förgänglighetsmotiv. Böckerna syftar såväl på helgonets översättning av Bibeln till latin, som på beständigheten i Guds ord.","Den helige Hieronymus botgörande","Francisco Collantes","Olja på duk","Mått 132,5 x 102,5 cm","NM 6140",1630,23190
"Porträtt,svensk,man",1920,,Banarbetare,"Helmer Osslund","Olja på smörpapper monterad på papp","Mått 45,5 x 31,5 cm","NM 6142",1920,23192
"Landskap,svensk,man",1860,,Grusbacke,"Carl Fredrik Hill","Olja på duk","Mått 64 x 81 cm","NM 6157",1876,23207
"Stadsbild,dansk,man",1900,,"Slottskyrkan i Köpenhamn","Vilhelm Hammershøi","Olja på duk","Mått 67 x 70 cm","NM 6167",1910,23216
"Landskap,svensk,man",1880,,Solnedgång,"August Strindberg","Olja på papp","Mått 23,5 x 32 cm","NM 6168",1892,23217
"Landskap,svensk,man",1880,,"Stormigt hav. Slätprick.","August Strindberg","Olja på  papp","Mått 31 x 19 cm","NM 6174",1892,23223
"Landskap,svensk,man",1880,,"Stormigt hav. Ruskprick","August Strindberg","Olja på papp 


","Mått 31 x 19,5 cm","NM 6175",1892,23224
"Barn,amerikansk,man",1760,"Gilbert Stuart föddes i Rhode Island då det var en brittisk koloni. Han blev den unga nationen USA:s mest framstående porträttkonstnär. Trots en långsam arbetsprocess var han mycket produktiv. Flera verk är oavslutade, bland dem hans allra mest kända av George Washington. Porträtten präglas av empati och insiktsfull skärpa. Förutom i Amerika, verkade Stuart i Skottland och England, där han utförde målningen av mrs Blades och hennes dotter.","Mrs. Blades och hennes dotter","Gilbert Stuart","Olja på duk","Mått 74 x 59 cm","NM 6178",1775,23227
"Religion/Mytologi,nederländsk",1460,"Medeltidens kvinnoideal och dygder såsom ödmjukhet återspeglas i bilden av Maria ammande sin nyfödde son, ett motiv från den bysantinska konsten. Intresset för naturen förenas med traditionell kristen symbolik – Jesusbarnets äpple syftar på den förbjudna frukten från kunskapens träd, den inhägnade trädgården symboliserar såväl Marias jungfruliga renhet som det förlorade Paradiset som Guds son återvunnit genom sitt människoblivande.","Madonnan med barnet","Mästaren till Katarinalegenden","Olja på trä","Mått 44 x 32 cm","NM 6179",1470,23228
