keywords,year,_description,_title,_artists,_material,_dimensions,_inventory_number,_realyear,id
"Porträtt,italiensk,okänd,italiensk,man",1700,,Bönder,"Okänd (Konstnär), Paolo Monaldi (Tidigare attribution)","Olja på trä","Mått 45 x 31 cm","NM 7237",1700,158010
"Porträtt,italiensk,okänd,italiensk,man",1740,,Bönder,"Okänd (Konstnär), Paolo Monaldi (Tidigare attribution)","Olja på trä","Mått 45 x 31,5 cm","NM 7243",1750,158016
"Religion/Mytologi,okänd,fransk,man",1600,,"Jungfru Maria med Jesusbarnet","Okänd (Konstnär), Nicolas Poussin (Tidigare attribution)","Olja på duk","Mått 27 x 40,5 cm","NM 7244",1600,158017
"Landskap,nederländsk,man",1620,,"Italienskt landskap med utsikt genom grottöppning","Jan Asselyn","Olja på trä","Mått 34,8 x 23,8 x 0,7 cm","NM 7247",1633,158021
"Landskap,okänd,fransk,man",1600,,Landskap,"Okänd (Konstnär), Claude Lorrain (Tidigare attribution)",,,"NM 7252",1600,158025
"Landskap,italiensk,okänd,italiensk,man",1600,,Landskap,"Okänd (Konstnär), Salvator Rosa (Tidigare attribution)","Olja på duk","Mått 25 x 18,5 cm","NM 7263",1600,158039
"Religion/Mytologi,okänd,italiensk,man",1500,,"Rinaldo och Armida","Okänd (Konstnär), Paolo Veronese (Tidigare attribution)","Olja på duk","Mått 25 x 17,5 cm","NM 7265",1500,158041
"Landskap,okänd,fransk,man",1600,,"Landskap med Vilan på flykten till Egypten","Okänd (Konstnär), Claude Lorrain (Tidigare attribution)",,,"NM 7267",1600,158044
"Religion/Mytologi,italiensk,man",1600,"Se beskrivning i engelska versionen",Apostlahuvud,"Michelangelo Merisi da Caravaggio","Olja på trä","Mått 42 x 43,5 cm (rundel)","NM 7268",1600,158045
"Religion/Mytologi,italiensk,okänd,italiensk,man",1500,,Diana,"Okänd (Konstnär), Giulio Romano (Tidigare attribution)","Olja på duk","Mått 45 x 37 cm","NM 7271",1500,158052
"Landskap,okänd",1600,,"Landskap med Vilan på flykten till Egypten","Ingen uppgift",,,"NM 7272",1600,158053
"Landskap,italiensk,okänd,italiensk,man",1600,,Landskap,"Okänd (Konstnär), Andrea Locatelli (Tidigare attribution)","Olja på duk","Mått 33,5 x 62 cm","NM 7275",1600,158057
"Religion/Mytologi,italiensk,okänd,italiensk,man",1600,,Madonna,"Okänd (Konstnär), Sassoferrato (eg. Giovanni Battista Salvi) (Tidigare attribution)","Olja på duk","Mått 65 x 54,5 cm","NM 7276",1600,158054
",svensk,man",1880,,Höpackning,"Nils Kreuger","Olja på träpannå","Mått 55 x 22,5 x 1,2 cm","NM 7277",1880,159220
"Landskap,holländsk,man",1600,,"Italienskt berglandskap med borgruin, djur och figurer","Adam Pynacker","Olja på ekpannå","Mått 37 x 41 cm","NM 7278",1600,159244
"Djur,holländsk,man",1640,,"Två pojkar som leker med en katt","Jan Miense Molenaer","Olja på ekpannå","Mått 48 x 37 cm","NM 7279",1650,159248
"Religion/Mytologi,italiensk,man",1620,"I Bibeln berättas hur herden David dödar Goliat med en sten från sin slunga och halshugger jätten med hans eget svärd. David ser på betraktaren med orubbligt självförtroende. Det grymma i berättelsen har tonats ned. I stället riktas fokus mot den rika färgskalan och flödande penselföringen i den antikinspirerade klädseln. Fetti använde den unge Ferdinando Gonzaga, hertig av Mantua, som modell för David. Målningens innebörd blev därmed politisk.","David med Goliats avhuggna huvud","Domenico Fetti","Olja på duk","Mått 160,7 x 99,1 cm","NM 7280",1620,159249
"Landskap,norsk,man",1820,"Thomas Fearnley är i dag mest känd för sina oljestudier. De uppmärksammades redan efter hans död då konstnären Johan Christian Dahl rekommenderade norska staten att köpa dem. Fearnley tog sig gärna an flyktiga motiv, som innebar tekniska utmaningar. I denna vy från Capri verkar syftet ha varit att fånga det egenartade kvällsljuset. Paret med guiden i förgrunden är förmodligen ett senare tillägg för att göra målningen mer kommersiellt gångbar.","Arco Naturale, Capri","Thomas Fearnley","Olja på papper uppklistrat på träpannå","Mått 61,5 x 46,1 cm","NM 7281",1833,159708
"Landskap,dansk,man",1840,,Landskapsstudie,"Peter Christian Skovgaard","Olja på papper uppklistrat på duk","Mått 33,5 x 24,7 cm","NM 7282",1840,159709
",svensk,man",1860,,Masugnen,"Wilhelm Wallander","Olja på duk","Mått 58,5 x 79 cm","NM 7283",1873,159715
"Barn,dansk,man",1840,"Månadens nyförvärv, Februari 2015  Porträtt utfört av Christen Købke   Nationalmuseums samling av danskt guldåldersmåleri har utökats genom förvärvet av Christen Købkes porträtt av den 5-årige Johan Jacob Krohn, konstnärens systerson. Porträttet är utfört 1846 och hör till ett av konstnärens mest känsliga och fångar väl bilden av barnet som individ. Købkes porträtt kompletterar övriga verk i museets samling och vittnar om mångsidigheten hos ett av Danmarks mest intressanta konstnärskap.  Under 1800-talets första hälft upplevde Danmark blomstrande tider inom alltifrån naturvetenskap och filosofi till litteratur, bildkonst och musikskapande. Perioden 1810-1850 har därför kommit att kallas för den danska guldåldern. Bildkonsten utmärks av ett intresse för vardagen och motiv som fanns tillgängliga i konstnärernas närhet.  Christen Købke är en av de främsta danska guldåldersmålarna. Han var en lika enastående porträttör som landskapsmålare. Liksom de flesta av guldålderns konstnärer gjorde Købke närmiljön till en betydelsefull del av sin motivkrets. Landskapsmålningarna föreställer ofta scenerier i närheten av hans bostad. Motiven har en oansenlig karaktär medan perspektiven fångar det oväntade. Skärpan är precis liksom ekonomin med uttrycksmedlen.  Intimitet är en annan egenskap som man inte minst finner i Købkes porträtt, till exempel framställningen av systersonen Johan Jacob Krohn (1841-1925), med tiden en framstående författare och skolman. Konstnärens bild av den lille 5-årigen är omedelbar och levande. Købkes målning är enastående skickligt utförd och ger samtidigt en trogen bild av individen. Just denna kombination av anspråkslöshet och mästerskap är utmärkande för de främsta danska guldåldermålarna och har bidragit till deras internationella ryktbarhet.  Förvärvet har möjliggjorts genom donationsmedel ur Wirosfonden. Nationalmuseum har inga egna medel att förvärva konst och konsthantverk för utan samlingarna berikas genom gåvor och privata stiftelse- och fondmedel.  Inventarienummer: NM 7285","Johan Jacob Krohn, konstnärens systerson, som barn","Christen Købke","Olja på duk","Mått 30 x 25 cm","NM 7285",1846,160037
"Landskap,norsk,man",1820,"Med muren i förgrunden är Johan Christian Dahls målning ovanlig som Vesuviusmotiv. Genom att så tydligt markera själva utsiktsplatsen verkar han vilja förmedla hela sin upplevelse i stunden där på takterrassen, kvällen den 20 juni 1820. Byggnaden är en lantegendom invid Neapelbukten där Dahl under några veckor var gäst hos den danske kronprinsen Kristian Fredrik.","Utsikt mot Vesuvius från Villa Quisisana","Johan Christian Dahl","Olja på duk","Mått 20 x 30 cm","NM 7287",1820,174865
"Landskap,dansk,man",1820,"För Italienresenärerna bjöd naturligtvis även vägen dit på intryck. I sin dagbok uttryckte Martinus Rørbye sin besvikelse över att Alperna blivit så exploaterade och att han var tvungen att dela dem med mängder av turister. Här har Rørbye sökt sig ett stycke bort från vägen för att måla vyn mot Chamonix-Mont-Blanc. Detta är en studie av ljusets effekter på landskapet lika mycket som ett resminne.","Vy mot Chamonix-Mont-Blanc","Martinus Rørbye","Olja på papper monterad på duk","Mått 33 x 41 cm","NM 7288",1834,174859
"Stadsbild,fransk,okänd",1800,,"Rivningstomt med palladiansk villa i bakgrunden",Okänd,"Olja på duk","Mått 32,4 x 40,6 cm","NM 7289",1818,174864
"Stilleben,flamländsk,man",1640,"Se även beskrivning i den engelska versionen","Stilleben med fiskar","Jan Dirven","Olja på trä","Mått 38 x 52 cm","NM 729",1648,17732
"Djur,holländsk,man",1600,"Beskrivning på inventarieblankett: På bordet framför en ung kvinna avbildad i halvfigur ligger tre döda fåglar, en duva, en rapphöna samt en kungsfiskare. Kvinnan är klädd i svart dräkt, håret är täckt av en slöja. Hon lyfter båda armarna i en gest som, tillsammans med den mörka klädseln, får tolkas som ett uttryck för sorg.  [slut]","Ung kvinna som sörjer en död duva, en rapphöna och en kungsfiskare","Jacques de Gheyn","Olja på valnötspannå","Mått 64,3 x 70,4 cm","NM 7290",1618,175143
"Religion/Mytologi,italiensk,man",1640,"Målningen är en allegori där den kvinnliga gestalten i förgrunden, Iustitia, personifierar det abstrakta begreppet ""rättvisan"". Hennes attribut är vågskålen och svärdet. Den öppna boken nedtill till vänster är 'Institutiones Justiniani', en del av 'Corpus iuris civilis', en kodifiering av den romerska rätten, som sammanställdes på 500-talet på order av kejsar Justinianus I (483-565 e.Kr.) och fick stort inflytande över rättsvetenskapen i både öst och väst.","Allegori över rättvisan (Justitia)","Bernardino Mei","Olja på duk","Mått 114,5 x 156 cm","NM 7291",1656,176296
"Porträtt,holländsk,man",1640,,"Porträtt av en ung kvinna","Pieter Fransz. de Grebber","Olja på ekpannå","Mått 66,5 x 47 x 1,4 cm [pannå]","NM 7292",1656,176297
"Porträtt,dansk,man",1780,"Beskrivning på inventarieblanketten:  Porträttet föreställer skulptören Johan Tobias Sergel i halvfigur. Han är klädd i rock och sidenväst samt skjorta.","Johann Tobias Sergel (1740-1814)","Jens Juel","Olja på duk","Mått 71 x 56,5 cm","NM 7293",1794,177191
"Barn,flamländsk,man",1640,"Pojken med rosiga kinder och ett virrvarr av blonda lockar var kanske son till någon i konstnärens bekantskapskrets. Målaren använde porträttstudien som Amors huvud i den stora målningen av den triumferande kärleken. Studien kopierades flera gånger, både av Willeboirts Bosschaert och av andra konstnärer, och pojken förekommer bland annat som ängel. Att göra så hörde till normal ateljépraxis i Antwerpen på 1600-talet.","Studie av ett pojkhuvud","Thomas Willeboirts Bosschaert","Olja på trä","Mått 37,5 x 29,3 cm","NM 7295",1642,177418
"Porträtt,fransk,okänd",1780,"Beskrivning på inventarieblanketten:  Målningen föreställer en kvinnlig konstnär med en krita eller ett ritstift en ena handen. På bordet ligger en tecknad porträttstudie.   Kommentar: Stilistiskt och måleritekniskt för porträttet tankarna till vissa verk av Abel de Pujol.","Porträtt av kvinnlig konstnär med teckning",Okänd,"Olja på trä","Mått 59 x 49 cm","NM 7296",1798,177752
"Porträtt,fransk,kvinna",1760,"Porträtt av en violinist föreställer troligen en av konstnärens tre systrar. Kompositionen präglas av ett stilla lugn och kontemplation. De brustna strängarna är en stor bildmässig kvalitet och är en symbol för livets förgänglighet. Målningen utfördes tre år efter att Anne Vallayer-Coster valts in i franska konstakademin, vilket uppfattades som en exceptionell händelse eftersom hon bara var 26 år, kvinna och ogift.","Porträtt av en violinist","Anne Vallayer-Coster","Olja på duk","Mått 116 x 96 cm","NM 7297",1773,177753
",fransk,man",1800,"Louis Leopold Boilly kunde uppnå en nästan obegriplig skärpa med sin måleriteknik. Tygerna i madame Saint-Ange Chevriers kläder är omsorgsfullt och realistiskt skildrade. Porträtt fungerade ofta som en social markör i dubbel mening: dels visar dräkten att modellen var modemedveten och förmögen nog att köpa de finaste materialen, dels att hon hade råd att anlita en av de porträttkonstnärer som verkligen kunde förmedla detta.","Madame Saint-Ange Chevrier","Louis-Léopold Boilly","Olja på duk","Mått 74 x 60 cm","NM 7298",1807,177754
"Barn,svensk,man",1880,"Målningens tyngdpunkt vilar i pojkens blick och i hans kropp, deformerad av skolios. Idealiserade skildringar av fattiga barn var vanliga inom genremåleriet. Richard Bergh valde däremot att avbilda modellen i hans egen miljö. Fiskeläget Concarneau i Bretagne, ett populärt resmål för de nordiska konstnärerna. Barnarbete var vanligt även i Europa under 1800-talet, speciellt i städerna, där arbetarklassen exploaterades i industrin.","Pojke från Concarneau","Richard Bergh","Olja på duk","Mått 90 x 70 cm","NM 7299",1882,177815
"Religion/Mytologi,nederländsk,man",1580,,"Grekiska flottans skeppsbrott på hemvägen från Troja","Joos de Momper d.y.","Olja på ek","Mått 154 x 173 cm","NM 730",1583,17733
"Landskap,holländsk,man",1620,"Beskrivning på inventarieblanketten: Målningen återger ett sommarlandskap, där en kraftig gärdesgård dominerar. I bildens mitt syns en öppen grind vid vilken två män samspråkar. I förgrunden sitter två personer och längst till vänster arbetar två män. I bildens högra del ses en by med kyrka och väderkvarn. Målningen återger ett sommarlandskap, där en kraftig gärdesgård dominerar. I bildens mitt syns en öppen grind vid vilken två män samspråkar. I förgrunden sitter två personer och längst till vänster arbetar två män. I bildens högra del ses en by med kyrka och väderkvarn.  Kommentar: Enligt Claës Tamm (2008) attribuerades målningen av auktionsföretaget Sotheby's 1986 till Salomon van Ruysdael, medan företrädare för Christie's 1991 bedömde att det troligen inte var fråga om ett arbete av konstnären. Målningen, som tidigare varit tillskriven Jan van Goyen, tillhörde ursprungligen familjen Grill på Österby bruk. I bouppteckningen efter Anna Johanna Grill d.y. (1720-1778) finns en lågt värderad målning kallad ""Ovalt Landskap."" Fredrik Sanders och Henryk Bukowskis förteckning över Österbysamlingen, daterad 25 november 1876, upprättad i samband med en bodelning, upptar som nr 66 i lotten nr 3 en målning värderad till 300 kr, ""S.v.Ruisdaels skola: Landskap, oval form"". Den ursprungliga ramen har bytts ut och ersatts med en förgylld rokokoram, troligen från 1700-talets mitt.  Litteratur: Claes Tamm, Österbysamlingen 'en rätt artig samling af målningar', Mjölby 2008, s.74, 145, ill.","Landskap med gärdesgård och figurer","Salomon van Ruysdael","Olja på ekpannå. Oval.","Mått 36,3 x 48,6 cm [oval]","NM 7300",1628,177817
",svensk,kvinna",1840,"År 1854 studerade Amalia Lindegren historiemåleri i München. Här fanns tidens ledande konstnärer på området och fantastiska museer där hon kunde inspireras av såväl äldre mästare som den allra senaste samtidskonsten. Under sin vistelse i staden utförde Lindgren bland annat en finstämd studie av en eftertänksam man i turban. I vilket syfte är inte känt, men den skulle kunna vara tänkt att användas för en större komposition med ett bibliskt ämne.","Studie av man i turkiskt dräkt","Amalia Lindegren","Olja på duk","Mått 73,5 x 58,5 cm","NM 7301",1854,177816
"Landskap,svensk,man",1900,"Beskrivning i inventariet: Målningen föreställer ett landskapsutsnitt i höstfärger, med en blå gärdesgård i nedre delen.   Litteratur: ""Konst i svenska hem"", band 6, upptagen samt avbildad sid 292 under samling 467: ""Fil. Dr Erik Fahlbeck, Djursholm"". Claes-Göran Forsberg, ""John Sten 1879-1922. Liv och konst"", 1990, avbildad i interiörfotografi från den första utställningen i Hudiksvall, sid 22.  Utställningar: Stadshotellet, Hudiksvall; Flickskolans gymnastiksal, Hudiksvall, 20 dec 1905 - 6 jan 1906. Nationalmuseum, Stockholm, ""Den unga expressionismen. Svenskt måleri 1909-20"", 1944, kat nr 453. [slut]",Höstlandskap,"John Sten","Olja på duk","Mått 67,5 x 45,5 cm","NM 7302",1906,177822
"Barn,svensk,kvinna",1880,"Konvalescenten var ett återkommande motiv under det sena 1800-talet. Sjukdomar var inte ovanliga och de flesta fick uppleva fasorna med exempelvis tuberkulos på nära håll. Jenny Nyströms målning visar att hon följde med i modet och hennes avsikt var att visa den på Salongen i Paris, men den passerade inte juryns nålsöga.",Konvalescenten,"Jenny Nyström","Olja på duk","Mått 154 x 115 cm","NM 7303",1884,177823
"Stadsbild,dansk,okänd",1820,,Klostergård,Okänd,"Olja på papper uppfodrat på duk","Mått 23 x 33,8 cm","NM 7304",1828,178038
"Barn,fransk,man",1780,"Beskrivning i inventariet: Målningen föreställer Constantia Foster med sitt syskonbarn i knäet. I bakgrunden en sekretär med en klocka på. Kommentar: Utförd under konstnärens exil i England. Utställningar: Royal Academy of Arts London, 1968","Constantia Foster med syskonbarn","Henri Pierre Danloux","Olja på duk","Mått 117,5 x 101,5 cm","NM 7305",1790,178039
"Porträtt,svensk,man",1900,"Beskrivning på inventarieblanketten:  Porträtt av ung kvinna.  Utställningar: Nationalmuseum, Minnesutställning 1919; Konstakademien, Stockholm 1949; Prins Eugens Waldemarsudde, Stockholm 2013  Litteratur: Prins Eugens Waldemarsudde: Konstnärskolonin på Tyresö, 2013, katalognr 40, avbildad i färg i utställningskatalogen, sid 69.","Porträtt av Bodil Faber (konstnären Viggo Johansens dotter)","Richard Bergh","Olja på duk","Mått 37 x 33 cm","NM 7306",1905,178062
"Porträtt,dansk,man",1820,"Målningen föreställer familjemedlemmar framställda som enskilda porträtt på samma pannå.","Konstnärens far, hustru, son och fosterson","Emilius Ditlev Bærentzen","Olja på pappanå","Mått 19 x 23 cm","NM 7307",1830,178515
"Landskap,tysk,man",1820,"Månadens nyförvärv Juni 2016:  Tre exempel på Dresden-romantik: Nationalmuseum har förvärvat tre exempel på Dresden-romantikens bildkonst. Fantasi från Alperna av Carl Gustav Carus, Ek och björk av Carl Julius von Leypold och Dresden i solnedgång av Knud Baade. Tillsammans med de verk av Johan Christian Dahl som sedan tidigare finns i samlingen går det nu att på ett mångsidigt sätt presentera ett viktigt skede i den nordeuropeiska konsthistorien.    Runt sekelskiftet 1800 och några decennier framåt var Dresden ett viktigt centrum för det som betecknas som romantiken inom litteratur, filosofi och bildkonst. Idéerna bakom det konstnärliga skapandet spred sig som ringar på vattnet över stora delar av Europa. En av tidens nyckelfigurer var Caspar David Friedrich, som stod för en fundamental förnyelse av landskapsmåleriet. Tidigare landskapskonst framställde ofta avlägsna scenerier bortom tid och rum – som ännu omkring år 1800 hade sin grund i Claude Lorrains arkadiska 1600-talsmåleri. Caspar David Friedrich bröt med det äldre idealet genom att måla mer verklighetsnära motiv. Han återgav naturen med stor precision och lät platserna i sina målningar framstå som om de liknade betraktarens egna omgivningar. Avsikten var dock samtidigt att betraktaren genom bilden skulle sättas i förbindelse med något annat, att bilden skulle väcka känslan av något svårgripbart bortom själva bildrummet. Något som kanske bäst kan beskrivas som en potential eller ett spelrum för den egna föreställningsförmågan. En relation mellan konstnär, bild och betraktare som ofta sägs motsvara romantikens själva essens och som formulerats i några berömda rader av poeten Novalis där han skriver att ”Världen måste romantiseras. Så återfinner man den ursprungliga meningen. Genom att ge det låga en högre innebörd, det vanliga en hemlighetsfull lyster, det kända värdigheten av någon okänt, det ändliga ett oändligt sken, så romantiserar jag det.”   Med naturtrogna delar komponerade Caspar David Friedrich landskapet på ett sätt som gör naturen till något fantasieggande istället för ren terräng. Som sätter fantasin i rörelse och som uppmärksammar betraktaren på det extraordinära i det välbekanta. Nationalmuseums tre nyförvärv bygger alla på denna princip.  Carl Gustav Carus (1789-1869) Fantasi från Alperna är en tillspetsad scen med de dominerande, dramatiskt arrangerade örnarna i förgrunden. Längtan var ett centralt begrepp i romantikens konst och litteratur, ofta illustrerat av horisonten eller av fjärran berg som man drömde sig bortom. Örnarna gör målningen till en närmast programartad bild, som ett slags bevis för att den inre blickens räckvidd saknar gränser. Carl Gustav Carus var i grunden läkare. Samtidigt var han nära vän med bland andra Goethe och personer i Dresdens intellektuella elit, som Caspar David Friedrich och Johan Christian Dahl.   Carl Julius von Leypold (1806-1874) var elev till både Johan Christian Dahl och Caspar David Friedrich. Han var den av Friedrichs elever som måleritekniskt kom sin lärare allra närmast – så till den grad att flera av hans målningar misstagits för verk av Friedrich och först under senare år kunnat identifieras som verk av honom själv. Nationalmuseums nyförvärvade målning är en studie som föreställer en ek och en björk på en slänt. Av dateringen, den 18 april 1832, att döma är den utförd inom loppet av en enda dag och det friska måleriet tyder på att Leypold arbetat framför motivet. Men samtidigt kan man tänka sig att konstnären inte funnit något sceneri som såg ut precis så här, utan att han hittat träden var för sig efter att ha bestämt sig för vad han avsåg att måla. Även om naturtroheten framstår som minutiös är det något med bilden som är svårt att sätta fingret på, något som sätter betraktarens fantasi i rörelse. Med sina försiktigt stiliserade grenverk för träden tankarna till gotiska katedralers ornamentik och slänten är avvägd på ett sådant sätt att tanken på vad som finns bakom är svår att släppa.   Den tredje målningen är inte mycket större än ett vykort, men storslagen till sin karaktär. Den är daterad 1838. Knud Baade (1808-1879) reste från Norge för att studera i Dresden för Johan Christian Dahl. Under sin tid i staden kom han även i kontakt med Caspar David Friedrich. Här han har målat en vy över Dresden, från en punkt vid floden Elbe strax utanför stadskärnan. Det är alldeles stilla och solen håller på att gå ner. Granskar man bilden i detalj hittar man egentligen inget man kan peka på som overkligt eller onaturligt, men ändå är det närmast så den framstår. Baade kan mycket väl ha målat vyn för att ha med sig hem som resminne. Man skulle med Novalis ord kunna säga att han romantiserat staden han vistats i och lärt känna och gett det ändliga och bekanta ett oändligt sken och värdigheten av det obekanta.   Förvärven har möjliggjorts genom donationsmedel ur Wirosfonden. Nationalmuseum har inga egna medel att förvärva konst och konsthantverk för utan samlingarna berikas genom gåvor och privata stiftelse- och fondmedel.  Carl Gustav Carus, Fantasi från Alperna, 1822, NM 7308 Carl Julius von Leypold, Ek och björk, 1832, NM 7327 Knud Baade, Dresden i solnedgång, 1838, NM 7325","Fantasi från Alperna","Carl Gustav Carus","Olja på duk","Mått 52,5 x 67 cm","NM 7308",1822,179389
"Landskap,svensk,man",1880,,"Franskt landskap","Ivar Nyberg","Olja på träpannå","Mått 61 x 34,5 cm","NM 7309",1880,179927
